{
  "format": "riff-spaced/riff",
  "version": 1,
  "id": "bench-octave-chug",
  "name": "Octave Chug",
  "createdAt": "2026-10-25T00:00:00Z",
  "updatedAt": "2026-10-25T00:00:00Z",
  "tuning": {
    "name": "Bb Standard",
    "pitches": [
      34,
      39,
      44,
      49,
      53,
      58
    ]
  },
  "tempo": {
    "bpm": 100
  },
  "timeSignature": {
    "beats": 4,
    "unit": 4
  },
  "ppq": 480,
  "lengthBars": 4,
  "sections": [
    {
      "id": "bench-octave-chug-s1",
      "label": "A",
      "startBar": 0,
      "lengthBars": 4,
      "kind": "main"
    }
  ],
  "notes": [
    {
      "id": "n000",
      "string": 6,
      "fret": 0,
      "start": 0,
      "duration": 240,
      "velocity": 100,
      "techniques": [
        "palmMute"
      ]
    },
    {
      "id": "n001",
      "string": 6,
      "fret": 0,
      "start": 240,
      "duration": 240,
      "velocity": 100,
      "techniques": [
        "palmMute"
      ]
    },
    {
      "id": "n002",
      "string": 6,
      "fret": 0,
      "start": 480,
      "duration": 240,
      "velocity": 100,
      "techniques": [
        "palmMute"
      ]
    },
    {
      "id": "n003",
      "string": 6,
      "fret": 0,
      "start": 720,
      "duration": 240,
      "velocity": 100,
      "techniques": [
        "palmMute"
      ]
    },
    {
      "id": "n004",
      "string": 6,
      "fret": 0,
      "start": 960,
      "duration": 240,
      "velocity": 100,
      "techniques": [
        "palmMute"
      ],
      "chordId": "c1"
    },
    {
      "id": "n005",
      "string": 4,
      "fret": 2,
      "start": 960,
      "duration": 240,
      "velocity": 100,
      "techniques": [
        "palmMute"
      ],
      "chordId": "c1"
    },
    {
      "id": "n006",
      "string": 6,
      "fret": 0,
      "start": 1200,
      "duration": 240,
      "velocity": 100,
      "techniques": [
        "palmMute"
      ]
    },
    {
      "id": "n007",
      "string": 6,
      "fret": 0,
      "start": 1440,
      "duration": 240,
      "velocity": 100,
      "techniques": [
        "palmMute"
      ]
    },
    {
      "id": "n008",
      "string": 6,
      "fret": 0,
      "start": 1680,
      "duration": 240,
      "velocity": 100,
      "techniques": [
        "palmMute"
      ]
    },
    {
      "id": "n009",
      "string": 6,
      "fret": 0,
      "start": 1920,
      "duration": 240,
      "velocity": 100,
      "techniques": [
        "palmMute"
      ]
    },
    {
      "id": "n010",
      "string": 6,
      "fret": 0,
      "start": 2160,
      "duration": 240,
      "velocity": 100,
      "techniques": [
        "palmMute"
      ]
    },
    {
      "id": "n011",
      "string": 6,
      "fret": 0,
      "start": 2400,
      "duration": 240,
      "velocity": 100,
      "techniques": [
        "palmMute"
      ]
    },
    {
      "id": "n012",
      "string": 6,
      "fret": 0,
      "start": 2640,
      "duration": 240,
      "velocity": 100,
      "techniques": [
        "palmMute"
      ]
    },
    {
      "id": "n013",
      "string": 6,
      "fret": 0,
      "start": 2880,
      "duration": 240,
      "velocity": 100,
      "techniques": [
        "palmMute"
      ],
      "chordId": "c2"
    },
    {
      "id": "n014",
      "string": 4,
      "fret": 2,
      "start": 2880,
      "duration": 240,
      "velocity": 100,
      "techniques": [
        "palmMute"
      ],
      "chordId": "c2"
    },
    {
      "id": "n015",
      "string": 6,
      "fret": 0,
      "start": 3120,
      "duration": 240,
      "velocity": 100,
      "techniques": [
        "palmMute"
      ]
    },
    {
      "id": "n016",
      "string": 6,
      "fret": 0,
      "start": 3360,
      "duration": 240,
      "velocity": 100,
      "techniques": [
        "palmMute"
      ]
    },
    {
      "id": "n017",
      "string": 6,
      "fret": 0,
      "start": 3600,
      "duration": 240,
      "velocity": 100,
      "techniques": [
        "palmMute"
      ]
    },
    {
      "id": "n018",
      "string": 6,
      "fret": 0,
      "start": 3840,
      "duration": 240,
      "velocity": 100,
      "techniques": [
        "palmMute"
      ]
    },
    {
      "id": "n019",
      "string": 6,
      "fret": 0,
      "start": 4080,
      "duration": 240,
      "velocity": 100,
      "techniques": [
        "palmMute"
      ]
    },
    {
      "id": "n020",
      "string": 6,
      "fret": 0,
      "start": 4320,
      "duration": 240,
      "velocity": 100,
      "techniques": [
        "palmMute"
      ]
    },
    {
      "id": "n021",
      "string": 6,
      "fret": 0,
      "start": 4560,
      "duration": 240,
      "velocity": 100,
      "techniques": [
        "palmMute"
      ]
    },
    {
      "id": "n022",
      "string": 6,
      "fret": 0,
      "start": 4800,
      "duration": 240,
      "velocity": 100,
      "techniques": [
        "palmMute"
      ],
      "chordId": "c3"
    },
    {
      "id": "n023",
      "string": 4,
      "fret": 2,
      "start": 4800,
      "duration": 240,
      "velocity": 100,
      "techniques": [
        "palmMute"
      ],
      "chordId": "c3"
    },
    {
      "id": "n024",
      "string": 6,
      "fret": 0,
      "start": 5040,
      "duration": 240,
      "velocity": 100,
      "techniques": [
        "palmMute"
      ]
    },
    {
      "id": "n025",
      "string": 6,
      "fret": 0,
      "start": 5280,
      "duration": 240,
      "velocity": 100,
      "techniques": [
        "palmMute"
      ]
    },
    {
      "id": "n026",
      "string": 6,
      "fret": 0,
      "start": 5520,
      "duration": 240,
      "velocity": 100,
      "techniques": [
        "palmMute"
      ]
    },
    {
      "id": "n027",
      "string": 6,
      "fret": 0,
      "start": 5760,
      "duration": 240,
      "velocity": 100,
      "techniques": [
        "palmMute"
      ]
    },
    {
      "id": "n028",
      "string": 6,
      "fret": 0,
      "start": 6000,
      "duration": 240,
      "velocity": 100,
      "techniques": [
        "palmMute"
      ]
    },
    {
      "id": "n029",
      "string": 6,
      "fret": 0,
      "start": 6240,
      "duration": 240,
      "velocity": 100,
      "techniques": [
        "palmMute"
      ]
    },
    {
      "id": "n030",
      "string": 6,
      "fret": 0,
      "start": 6480,
      "duration": 240,
      "velocity": 100,
      "techniques": [
        "palmMute"
      ]
    },
    {
      "id": "n031",
      "string": 6,
      "fret": 0,
      "start": 6720,
      "duration": 240,
      "velocity": 100,
      "techniques": [
        "palmMute"
      ],
      "chordId": "c4"
    },
    {
      "id": "n032",
      "string": 4,
      "fret": 2,
      "start": 6720,
      "duration": 240,
      "velocity": 100,
      "techniques": [
        "palmMute"
      ],
      "chordId": "c4"
    },
    {
      "id": "n033",
      "string": 6,
      "fret": 0,
      "start": 6960,
      "duration": 240,
      "velocity": 100,
      "techniques": [
        "palmMute"
      ]
    },
    {
      "id": "n034",
      "string": 6,
      "fret": 0,
      "start": 7200,
      "duration": 240,
      "velocity": 100,
      "techniques": [
        "palmMute"
      ]
    },
    {
      "id": "n035",
      "string": 6,
      "fret": 0,
      "start": 7440,
      "duration": 240,
      "velocity": 100,
      "techniques": [
        "letRing"
      ],
      "chordId": "c5"
    },
    {
      "id": "n036",
      "string": 4,
      "fret": 2,
      "start": 7440,
      "duration": 240,
      "velocity": 100,
      "techniques": [
        "letRing"
      ],
      "chordId": "c5"
    }
  ],
  "tags": [
    "bench",
    "octave",
    "palm-mute"
  ],
  "style": {
    "genres": [
      "sludge",
      "doom"
    ],
    "notes": "Open Bb1 eighths with a Bb1 + Bb2 octave dyad on beat 3."
  },
  "namingPrefs": {
    "accidentals": "flats"
  },
  "source": {
    "type": "manual"
  }
}
